{
  "schemaVersion": 1,
  "sceneId": "03dbcb77-887b-55d7-afab-fc031089fcd0",
  "name": "Мой дом (демо-планировка)",
  "demo": true,
  "projection": "isometric-2:1",
  "assets": [
    {
      "id": "cozy/desk",
      "label": "Рабочий стол",
      "footprint": {
        "w": 3.2,
        "d": 1.6
      },
      "height": 1.5,
      "art": {
        "kind": "procedural",
        "ref": "cozy/desk",
        "status": "placeholder"
      }
    },
    {
      "id": "cozy/monitor",
      "label": "Монитор",
      "footprint": {
        "w": 1.4,
        "d": 0.4
      },
      "height": 1.0,
      "art": {
        "kind": "procedural",
        "ref": "cozy/monitor",
        "status": "placeholder"
      }
    },
    {
      "id": "cozy/desk_lamp",
      "label": "Настольная лампа",
      "footprint": {
        "w": 0.5,
        "d": 0.5
      },
      "height": 1.1,
      "art": {
        "kind": "procedural",
        "ref": "cozy/desk_lamp",
        "status": "placeholder"
      }
    },
    {
      "id": "cozy/pc_tower",
      "label": "Системный блок",
      "footprint": {
        "w": 0.6,
        "d": 1.2
      },
      "height": 1.2,
      "art": {
        "kind": "procedural",
        "ref": "cozy/pc_tower",
        "status": "placeholder"
      }
    },
    {
      "id": "cozy/office_chair",
      "label": "Кресло",
      "footprint": {
        "w": 1.1,
        "d": 1.1
      },
      "height": 2.0,
      "art": {
        "kind": "procedural",
        "ref": "cozy/office_chair",
        "status": "placeholder"
      }
    },
    {
      "id": "cozy/bookshelf",
      "label": "Книжный шкаф",
      "footprint": {
        "w": 2.4,
        "d": 0.8
      },
      "height": 3.6,
      "art": {
        "kind": "procedural",
        "ref": "cozy/bookshelf",
        "status": "placeholder"
      }
    },
    {
      "id": "cozy/plant",
      "label": "Растение",
      "footprint": {
        "w": 0.9,
        "d": 0.9
      },
      "height": 2.0,
      "art": {
        "kind": "procedural",
        "ref": "cozy/plant",
        "status": "placeholder"
      }
    },
    {
      "id": "cozy/rug",
      "label": "Ковёр",
      "footprint": {
        "w": 4.0,
        "d": 3.0
      },
      "height": 0.05,
      "art": {
        "kind": "procedural",
        "ref": "cozy/rug",
        "status": "placeholder"
      }
    },
    {
      "id": "cozy/server_rack",
      "label": "Серверная стойка",
      "footprint": {
        "w": 1.6,
        "d": 1.8
      },
      "height": 4.2,
      "art": {
        "kind": "procedural",
        "ref": "cozy/server_rack",
        "status": "placeholder"
      }
    },
    {
      "id": "cozy/shelf",
      "label": "Стеллаж",
      "footprint": {
        "w": 2.6,
        "d": 1.0
      },
      "height": 3.0,
      "art": {
        "kind": "procedural",
        "ref": "cozy/shelf",
        "status": "placeholder"
      }
    },
    {
      "id": "cozy/server_box",
      "label": "Домашний сервер",
      "footprint": {
        "w": 1.0,
        "d": 0.9
      },
      "height": 0.9,
      "art": {
        "kind": "procedural",
        "ref": "cozy/server_box",
        "status": "placeholder"
      }
    },
    {
      "id": "cozy/network_switch",
      "label": "Коммутатор",
      "footprint": {
        "w": 1.4,
        "d": 0.7
      },
      "height": 0.35,
      "art": {
        "kind": "procedural",
        "ref": "cozy/network_switch",
        "status": "placeholder"
      }
    },
    {
      "id": "cozy/crate",
      "label": "Ящик для хранения",
      "footprint": {
        "w": 1.0,
        "d": 0.8
      },
      "height": 0.8,
      "art": {
        "kind": "procedural",
        "ref": "cozy/crate",
        "status": "placeholder"
      }
    },
    {
      "id": "cozy/tv_stand",
      "label": "Тумба",
      "footprint": {
        "w": 3.6,
        "d": 1.2
      },
      "height": 1.0,
      "art": {
        "kind": "procedural",
        "ref": "cozy/tv_stand",
        "status": "placeholder"
      }
    },
    {
      "id": "cozy/tv",
      "label": "Телевизор",
      "footprint": {
        "w": 3.0,
        "d": 0.3
      },
      "height": 1.8,
      "art": {
        "kind": "procedural",
        "ref": "cozy/tv",
        "status": "placeholder"
      }
    },
    {
      "id": "cozy/tv_stick",
      "label": "ТВ-приставка",
      "footprint": {
        "w": 0.4,
        "d": 0.4
      },
      "height": 0.15,
      "art": {
        "kind": "procedural",
        "ref": "cozy/tv_stick",
        "status": "placeholder"
      }
    },
    {
      "id": "cozy/sofa",
      "label": "Диван",
      "footprint": {
        "w": 4.2,
        "d": 1.8
      },
      "height": 1.6,
      "art": {
        "kind": "procedural",
        "ref": "cozy/sofa",
        "status": "placeholder"
      }
    },
    {
      "id": "cozy/coffee_table",
      "label": "Журнальный столик",
      "footprint": {
        "w": 2.2,
        "d": 1.2
      },
      "height": 0.8,
      "art": {
        "kind": "procedural",
        "ref": "cozy/coffee_table",
        "status": "placeholder"
      }
    },
    {
      "id": "cozy/floor_lamp",
      "label": "Торшер",
      "footprint": {
        "w": 0.8,
        "d": 0.8
      },
      "height": 3.2,
      "art": {
        "kind": "procedural",
        "ref": "cozy/floor_lamp",
        "status": "placeholder"
      }
    },
    {
      "id": "cozy/network_cabinet",
      "label": "Сетевой шкаф",
      "footprint": {
        "w": 1.8,
        "d": 1.0
      },
      "height": 3.0,
      "art": {
        "kind": "procedural",
        "ref": "cozy/network_cabinet",
        "status": "placeholder"
      }
    },
    {
      "id": "cozy/side_table",
      "label": "Столик",
      "footprint": {
        "w": 1.4,
        "d": 1.0
      },
      "height": 1.3,
      "art": {
        "kind": "procedural",
        "ref": "cozy/side_table",
        "status": "placeholder"
      }
    },
    {
      "id": "cozy/router",
      "label": "Роутер",
      "footprint": {
        "w": 1.0,
        "d": 0.6
      },
      "height": 0.9,
      "art": {
        "kind": "procedural",
        "ref": "cozy/router",
        "status": "placeholder"
      }
    },
    {
      "id": "cozy/link_panel",
      "label": "Панель индикаторов",
      "footprint": {
        "w": 2.0,
        "d": 0.15
      },
      "height": 1.0,
      "art": {
        "kind": "procedural",
        "ref": "cozy/link_panel",
        "status": "placeholder"
      }
    },
    {
      "id": "cozy/bot_station",
      "label": "Рабочая станция бота",
      "footprint": {
        "w": 2.2,
        "d": 1.4
      },
      "height": 1.5,
      "art": {
        "kind": "procedural",
        "ref": "cozy/bot_station",
        "status": "placeholder"
      }
    },
    {
      "id": "cozy/bot",
      "label": "Бот",
      "footprint": {
        "w": 0.8,
        "d": 0.8
      },
      "height": 1.3,
      "art": {
        "kind": "procedural",
        "ref": "cozy/bot",
        "status": "placeholder"
      }
    },
    {
      "id": "cozy/terminal",
      "label": "Терминал",
      "footprint": {
        "w": 1.0,
        "d": 1.0
      },
      "height": 2.2,
      "art": {
        "kind": "procedural",
        "ref": "cozy/terminal",
        "status": "placeholder"
      }
    }
  ],
  "rooms": [
    {
      "id": "744aacce-cd98-57d8-a0b5-6fdba72d89fb",
      "name": "Кабинет",
      "kind": "office",
      "origin": {
        "x": 0,
        "y": 0
      },
      "size": {
        "w": 10,
        "d": 8
      },
      "wallHeight": 5.0,
      "style": {
        "floor": "oak",
        "wall": "cream"
      },
      "metadata": {}
    },
    {
      "id": "7f27e4aa-a27f-5c03-a202-a92be9549fc3",
      "name": "Гостиная",
      "kind": "living",
      "origin": {
        "x": 10,
        "y": 0
      },
      "size": {
        "w": 12,
        "d": 8
      },
      "wallHeight": 5.0,
      "style": {
        "floor": "oak_warm",
        "wall": "milk"
      },
      "metadata": {}
    },
    {
      "id": "8c31ff77-01a9-522c-86b8-3cc2986bdf0c",
      "name": "Серверная",
      "kind": "server",
      "origin": {
        "x": 22,
        "y": 0
      },
      "size": {
        "w": 7,
        "d": 8
      },
      "wallHeight": 5.0,
      "style": {
        "floor": "tile",
        "wall": "sand"
      },
      "metadata": {}
    },
    {
      "id": "47114833-4302-56db-9c8f-630552cf8c07",
      "name": "Сетевая",
      "kind": "network",
      "origin": {
        "x": 0,
        "y": 8
      },
      "size": {
        "w": 8,
        "d": 7
      },
      "wallHeight": 5.0,
      "style": {
        "floor": "tile",
        "wall": "beige"
      },
      "metadata": {}
    },
    {
      "id": "7b7d0105-30e1-5d18-ac53-11bd220bcab8",
      "name": "Автоматизация",
      "kind": "automation",
      "origin": {
        "x": 8,
        "y": 8
      },
      "size": {
        "w": 12,
        "d": 7
      },
      "wallHeight": 5.0,
      "style": {
        "floor": "carpet",
        "wall": "cream"
      },
      "metadata": {}
    }
  ],
  "objects": [
    {
      "id": "1c59bfc9-7da4-57b9-a874-841eb021c50d",
      "roomId": "744aacce-cd98-57d8-a0b5-6fdba72d89fb",
      "assetId": "cozy/bookshelf",
      "label": "Книжный шкаф",
      "position": {
        "x": 6.6,
        "y": 0.2,
        "z": 0
      },
      "rotation": 0,
      "scale": 1.0,
      "layer": "object",
      "entityBinding": null,
      "visualState": null,
      "metadata": {}
    },
    {
      "id": "fa293c16-9088-52d1-becd-43799f896d77",
      "roomId": "744aacce-cd98-57d8-a0b5-6fdba72d89fb",
      "assetId": "cozy/desk",
      "label": "Рабочий стол",
      "position": {
        "x": 2.0,
        "y": 0.3,
        "z": 0
      },
      "rotation": 0,
      "scale": 1.0,
      "layer": "object",
      "entityBinding": null,
      "visualState": null,
      "metadata": {}
    },
    {
      "id": "b35fedc1-0810-5e01-9a34-4ff590717af9",